{
  "$id": "esp.json/fields/array.schema.json",
  "$schema": "http://json-schema.org/draft-07/schema#",
  "title": "Array",
  "type": "object",
  "required": ["type", "element"],
  "properties": {
    "name": {
      "$ref": "../shared/name.schema.json"
    },
    "type": {
      "constant": "array"
    },
    "counter": {
      "$ref": "../shared/counter.schema.json"
    },
    "sorted": {
      "$ref": "../shared/sorted.schema.json"
    },
    "size": {
      "$ref": "../shared/size.schema.json"
    },
    "prefix": {
      "$ref": "../shared/prefix.schema.json"
    },
    "element": {
      "$ref": "../field.schema.json"
    }
  }
}
